No.     Source                Protocol Length Info
      4 192.168.4.2           TCP      93     49838 → 5233 [PSH, ACK] Seq=1 Ack=1 Win=64240 Len=39

Frame 4: 93 bytes on wire (744 bits), 93 bytes captured (744 bits) on interface 0
    Interface id: 0 (\Device\NPF_{7914756B-14C8-4F93-8736-96A4610EEEB2})
        Interface name: \Device\NPF_{7914756B-14C8-4F93-8736-96A4610EEEB2}
        Interface description: Wi-Fi
    Encapsulation type: Ethernet (1)
    Arrival Time: Jan 21, 2020 00:34:40.794767000 CET
    [Time shift for this packet: 0.000000000 seconds]
    Epoch Time: 1579563280.794767000 seconds
    [Time delta from previous captured frame: 0.510689000 seconds]
    [Time delta from previous displayed frame: 0.000000000 seconds]
    [Time since reference or first frame: 0.533646000 seconds]
    Frame Number: 4
    Frame Length: 93 bytes (744 bits)
    Capture Length: 93 bytes (744 bits)
    [Frame is marked: False]
    [Frame is ignored: False]
    [Protocols in frame: eth:ethertype:ip:tcp:data]
    [Coloring Rule Name: TCP]
    [Coloring Rule String: tcp]
Ethernet II, Src: KingjonD_6c:00:2b (00:13:ef:6c:00:2b), Dst: ee:fa:bc:c2:2e:c5 (ee:fa:bc:c2:2e:c5)
    Destination: ee:fa:bc:c2:2e:c5 (ee:fa:bc:c2:2e:c5)
        Address: ee:fa:bc:c2:2e:c5 (ee:fa:bc:c2:2e:c5)
        .... ..1. .... .... .... .... = LG bit: Locally administered address (this is NOT the factory default)
        .... ...0 .... .... .... .... = IG bit: Individual address (unicast)
    Source: KingjonD_6c:00:2b (00:13:ef:6c:00:2b)
        Address: KingjonD_6c:00:2b (00:13:ef:6c:00:2b)
        .... ..0. .... .... .... .... = LG bit: Globally unique address (factory default)
        .... ...0 .... .... .... .... = IG bit: Individual address (unicast)
    Type: IPv4 (0x0800)
Internet Protocol Version 4, Src: 192.168.4.2, Dst: 192.168.4.1
    0100 .... = Version: 4
    .... 0101 = Header Length: 20 bytes (5)
    Differentiated Services Field: 0x00 (DSCP: CS0, ECN: Not-ECT)
        0000 00.. = Differentiated Services Codepoint: Default (0)
        .... ..00 = Explicit Congestion Notification: Not ECN-Capable Transport (0)
    Total Length: 79
    Identification: 0xc5ea (50666)
    Flags: 0x4000, Don't fragment
        0... .... .... .... = Reserved bit: Not set
        .1.. .... .... .... = Don't fragment: Set
        ..0. .... .... .... = More fragments: Not set
        ...0 0000 0000 0000 = Fragment offset: 0
    Time to live: 128
    Protocol: TCP (6)
    Header checksum: 0xab6a [validation disabled]
    [Header checksum status: Unverified]
    Source: 192.168.4.2
    Destination: 192.168.4.1
Transmission Control Protocol, Src Port: 49838, Dst Port: 5233, Seq: 1, Ack: 1, Len: 39
    Source Port: 49838
    Destination Port: 5233
    [Stream index: 0]
    [TCP Segment Len: 39]
    Sequence number: 1    (relative sequence number)
    [Next sequence number: 40    (relative sequence number)]
    Acknowledgment number: 1    (relative ack number)
    0101 .... = Header Length: 20 bytes (5)
    Flags: 0x018 (PSH, ACK)
        000. .... .... = Reserved: Not set
        ...0 .... .... = Nonce: Not set
        .... 0... .... = Congestion Window Reduced (CWR): Not set
        .... .0.. .... = ECN-Echo: Not set
        .... ..0. .... = Urgent: Not set
        .... ...1 .... = Acknowledgment: Set
        .... .... 1... = Push: Set
        .... .... .0.. = Reset: Not set
        .... .... ..0. = Syn: Not set
        .... .... ...0 = Fin: Not set
        [TCP Flags: ·······AP···]
    Window size value: 64240
    [Calculated window size: 64240]
    [Window size scaling factor: -2 (no window scaling used)]
    Checksum: 0xc6c0 [unverified]
    [Checksum Status: Unverified]
    Urgent pointer: 0
    [SEQ/ACK analysis]
        [iRTT: 0.022957000 seconds]
        [Bytes in flight: 39]
        [Bytes sent since last PSH flag: 39]
    [Timestamps]
        [Time since first frame in this TCP stream: 0.533646000 seconds]
        [Time since previous frame in this TCP stream: 0.510689000 seconds]
    TCP payload (39 bytes)
Data (39 bytes)
    Data: 633065656237633962616133303230303030303030303134...
    [Length: 39]

0000  ee fa bc c2 2e c5 00 13 ef 6c 00 2b 08 00 45 00   .........l.+..E.
0010  00 4f c5 ea 40 00 80 06 ab 6a c0 a8 04 02 c0 a8   .O..@....j......
0020  04 01 c2 ae 14 71 31 79 62 29 00 00 1a 8f 50 18   .....q1yb)....P.
0030  fa f0 c6 c0 00 00 63 30 65 65 62 37 63 39 62 61   ......c0eeb7c9ba
0040  61 33 30 32 30 30 30 30 30 30 30 30 31 34 63 63   a3020000000014cc
0050  33 38 6c 66 68 62 66 62 35 64 32 61 32            38lfhbfb5d2a2

No.     Source                Protocol Length Info
      5 192.168.4.1           TCP      241    5233 → 49838 [PSH, ACK] Seq=1 Ack=40 Win=5801 Len=187

Frame 5: 241 bytes on wire (1928 bits), 241 bytes captured (1928 bits) on interface 0
    Interface id: 0 (\Device\NPF_{7914756B-14C8-4F93-8736-96A4610EEEB2})
        Interface name: \Device\NPF_{7914756B-14C8-4F93-8736-96A4610EEEB2}
        Interface description: Wi-Fi
    Encapsulation type: Ethernet (1)
    Arrival Time: Jan 21, 2020 00:34:40.852562000 CET
    [Time shift for this packet: 0.000000000 seconds]
    Epoch Time: 1579563280.852562000 seconds
    [Time delta from previous captured frame: 0.057795000 seconds]
    [Time delta from previous displayed frame: 0.057795000 seconds]
    [Time since reference or first frame: 0.591441000 seconds]
    Frame Number: 5
    Frame Length: 241 bytes (1928 bits)
    Capture Length: 241 bytes (1928 bits)
    [Frame is marked: False]
    [Frame is ignored: False]
    [Protocols in frame: eth:ethertype:ip:tcp:data]
    [Coloring Rule Name: TCP]
    [Coloring Rule String: tcp]
Ethernet II, Src: ee:fa:bc:c2:2e:c5 (ee:fa:bc:c2:2e:c5), Dst: KingjonD_6c:00:2b (00:13:ef:6c:00:2b)
    Destination: KingjonD_6c:00:2b (00:13:ef:6c:00:2b)
        Address: KingjonD_6c:00:2b (00:13:ef:6c:00:2b)
        .... ..0. .... .... .... .... = LG bit: Globally unique address (factory default)
        .... ...0 .... .... .... .... = IG bit: Individual address (unicast)
    Source: ee:fa:bc:c2:2e:c5 (ee:fa:bc:c2:2e:c5)
        Address: ee:fa:bc:c2:2e:c5 (ee:fa:bc:c2:2e:c5)
        .... ..1. .... .... .... .... = LG bit: Locally administered address (this is NOT the factory default)
        .... ...0 .... .... .... .... = IG bit: Individual address (unicast)
    Type: IPv4 (0x0800)
Internet Protocol Version 4, Src: 192.168.4.1, Dst: 192.168.4.2
    0100 .... = Version: 4
    .... 0101 = Header Length: 20 bytes (5)
    Differentiated Services Field: 0x00 (DSCP: CS0, ECN: Not-ECT)
        0000 00.. = Differentiated Services Codepoint: Default (0)
        .... ..00 = Explicit Congestion Notification: Not ECN-Capable Transport (0)
    Total Length: 227
    Identification: 0x0062 (98)
    Flags: 0x4000, Don't fragment
        0... .... .... .... = Reserved bit: Not set
        .1.. .... .... .... = Don't fragment: Set
        ..0. .... .... .... = More fragments: Not set
        ...0 0000 0000 0000 = Fragment offset: 0
    Time to live: 128
    Protocol: TCP (6)
    Header checksum: 0x705f [validation disabled]
    [Header checksum status: Unverified]
    Source: 192.168.4.1
    Destination: 192.168.4.2
Transmission Control Protocol, Src Port: 5233, Dst Port: 49838, Seq: 1, Ack: 40, Len: 187
    Source Port: 5233
    Destination Port: 49838
    [Stream index: 0]
    [TCP Segment Len: 187]
    Sequence number: 1    (relative sequence number)
    [Next sequence number: 188    (relative sequence number)]
    Acknowledgment number: 40    (relative ack number)
    0101 .... = Header Length: 20 bytes (5)
    Flags: 0x018 (PSH, ACK)
        000. .... .... = Reserved: Not set
        ...0 .... .... = Nonce: Not set
        .... 0... .... = Congestion Window Reduced (CWR): Not set
        .... .0.. .... = ECN-Echo: Not set
        .... ..0. .... = Urgent: Not set
        .... ...1 .... = Acknowledgment: Set
        .... .... 1... = Push: Set
        .... .... .0.. = Reset: Not set
        .... .... ..0. = Syn: Not set
        .... .... ...0 = Fin: Not set
        [TCP Flags: ·······AP···]
    Window size value: 5801
    [Calculated window size: 5801]
    [Window size scaling factor: -2 (no window scaling used)]
    Checksum: 0xa79a [unverified]
    [Checksum Status: Unverified]
    Urgent pointer: 0
    [SEQ/ACK analysis]
        [This is an ACK to the segment in frame: 4]
        [The RTT to ACK the segment was: 0.057795000 seconds]
        [iRTT: 0.022957000 seconds]
        [Bytes in flight: 187]
        [Bytes sent since last PSH flag: 187]
    [Timestamps]
        [Time since first frame in this TCP stream: 0.591441000 seconds]
        [Time since previous frame in this TCP stream: 0.057795000 seconds]
    TCP payload (187 bytes)
Data (187 bytes)
    Data: 633065656237633962616133303230303030303030303132...
    [Length: 187]

0000  00 13 ef 6c 00 2b ee fa bc c2 2e c5 08 00 45 00   ...l.+........E.
0010  00 e3 00 62 40 00 80 06 70 5f c0 a8 04 01 c0 a8   ...b@...p_......
0020  04 02 14 71 c2 ae 00 00 1a 8f 31 79 62 50 50 18   ...q......1ybPP.
0030  16 a9 a7 9a 00 00 63 30 65 65 62 37 63 39 62 61   ......c0eeb7c9ba
0040  61 33 30 32 30 30 30 30 30 30 30 30 31 32 63 63   a3020000000012cc
0050  33 38 6c 6e 74 32 30 30 31 30 30 5f 67 72 65 65   38lnt200100_gree
0060  6e 5f 65 61 72 74 68 2e 62 69 6e 32 30 30 32 30   n_earth.bin20020
0070  31 5f 67 72 65 65 6e 5f 65 61 72 74 68 2e 62 69   1_green_earth.bi
0080  6e 32 32 30 33 30 32 5f 73 70 69 6e 6e 69 6e 67   n220302_spinning
0090  5f 63 6f 69 6e 2e 62 69 6e 32 32 30 34 30 33 5f   _coin.bin220403_
00a0  73 70 69 6e 6e 69 6e 67 5f 63 6f 69 6e 2e 62 69   spinning_coin.bi
00b0  6e 32 33 30 35 30 34 5f 62 6f 75 6e 63 69 6e 67   n230504_bouncing
00c0  5f 66 72 61 70 68 2e 62 69 6e 32 33 30 36 30 35   _fraph.bin230605
00d0  5f 73 70 69 6e 6e 69 6e 67 5f 68 65 61 72 74 2e   _spinning_heart.
00e0  62 69 6e 30 32 48 45 31 31 62 66 62 35 64 32 61   bin02HE11bfb5d2a
00f0  32                                                2

No.     Source                Protocol Length Info
      7 192.168.4.2           TCP      93     49838 → 5233 [PSH, ACK] Seq=40 Ack=188 Win=64053 Len=39

Frame 7: 93 bytes on wire (744 bits), 93 bytes captured (744 bits) on interface 0
    Interface id: 0 (\Device\NPF_{7914756B-14C8-4F93-8736-96A4610EEEB2})
        Interface name: \Device\NPF_{7914756B-14C8-4F93-8736-96A4610EEEB2}
        Interface description: Wi-Fi
    Encapsulation type: Ethernet (1)
    Arrival Time: Jan 21, 2020 00:34:41.387427000 CET
    [Time shift for this packet: 0.000000000 seconds]
    Epoch Time: 1579563281.387427000 seconds
    [Time delta from previous captured frame: 0.468912000 seconds]
    [Time delta from previous displayed frame: 0.534865000 seconds]
    [Time since reference or first frame: 1.126306000 seconds]
    Frame Number: 7
    Frame Length: 93 bytes (744 bits)
    Capture Length: 93 bytes (744 bits)
    [Frame is marked: False]
    [Frame is ignored: False]
    [Protocols in frame: eth:ethertype:ip:tcp:data]
    [Coloring Rule Name: TCP]
    [Coloring Rule String: tcp]
Ethernet II, Src: KingjonD_6c:00:2b (00:13:ef:6c:00:2b), Dst: ee:fa:bc:c2:2e:c5 (ee:fa:bc:c2:2e:c5)
    Destination: ee:fa:bc:c2:2e:c5 (ee:fa:bc:c2:2e:c5)
        Address: ee:fa:bc:c2:2e:c5 (ee:fa:bc:c2:2e:c5)
        .... ..1. .... .... .... .... = LG bit: Locally administered address (this is NOT the factory default)
        .... ...0 .... .... .... .... = IG bit: Individual address (unicast)
    Source: KingjonD_6c:00:2b (00:13:ef:6c:00:2b)
        Address: KingjonD_6c:00:2b (00:13:ef:6c:00:2b)
        .... ..0. .... .... .... .... = LG bit: Globally unique address (factory default)
        .... ...0 .... .... .... .... = IG bit: Individual address (unicast)
    Type: IPv4 (0x0800)
Internet Protocol Version 4, Src: 192.168.4.2, Dst: 192.168.4.1
    0100 .... = Version: 4
    .... 0101 = Header Length: 20 bytes (5)
    Differentiated Services Field: 0x00 (DSCP: CS0, ECN: Not-ECT)
        0000 00.. = Differentiated Services Codepoint: Default (0)
        .... ..00 = Explicit Congestion Notification: Not ECN-Capable Transport (0)
    Total Length: 79
    Identification: 0xc5ec (50668)
    Flags: 0x4000, Don't fragment
        0... .... .... .... = Reserved bit: Not set
        .1.. .... .... .... = Don't fragment: Set
        ..0. .... .... .... = More fragments: Not set
        ...0 0000 0000 0000 = Fragment offset: 0
    Time to live: 128
    Protocol: TCP (6)
    Header checksum: 0xab68 [validation disabled]
    [Header checksum status: Unverified]
    Source: 192.168.4.2
    Destination: 192.168.4.1
Transmission Control Protocol, Src Port: 49838, Dst Port: 5233, Seq: 40, Ack: 188, Len: 39
    Source Port: 49838
    Destination Port: 5233
    [Stream index: 0]
    [TCP Segment Len: 39]
    Sequence number: 40    (relative sequence number)
    [Next sequence number: 79    (relative sequence number)]
    Acknowledgment number: 188    (relative ack number)
    0101 .... = Header Length: 20 bytes (5)
    Flags: 0x018 (PSH, ACK)
        000. .... .... = Reserved: Not set
        ...0 .... .... = Nonce: Not set
        .... 0... .... = Congestion Window Reduced (CWR): Not set
        .... .0.. .... = ECN-Echo: Not set
        .... ..0. .... = Urgent: Not set
        .... ...1 .... = Acknowledgment: Set
        .... .... 1... = Push: Set
        .... .... .0.. = Reset: Not set
        .... .... ..0. = Syn: Not set
        .... .... ...0 = Fin: Not set
        [TCP Flags: ·······AP···]
    Window size value: 64053
    [Calculated window size: 64053]
    [Window size scaling factor: -2 (no window scaling used)]
    Checksum: 0xc699 [unverified]
    [Checksum Status: Unverified]
    Urgent pointer: 0
    [SEQ/ACK analysis]
        [iRTT: 0.022957000 seconds]
        [Bytes in flight: 39]
        [Bytes sent since last PSH flag: 39]
    [Timestamps]
        [Time since first frame in this TCP stream: 1.126306000 seconds]
        [Time since previous frame in this TCP stream: 0.468912000 seconds]
    TCP payload (39 bytes)
Data (39 bytes)
    Data: 633065656237633962616133303230303030303030303134...
    [Length: 39]

0000  ee fa bc c2 2e c5 00 13 ef 6c 00 2b 08 00 45 00   .........l.+..E.
0010  00 4f c5 ec 40 00 80 06 ab 68 c0 a8 04 02 c0 a8   .O..@....h......
0020  04 01 c2 ae 14 71 31 79 62 50 00 00 1b 4a 50 18   .....q1ybP...JP.
0030  fa 35 c6 99 00 00 63 30 65 65 62 37 63 39 62 61   .5....c0eeb7c9ba
0040  61 33 30 32 30 30 30 30 30 30 30 30 31 34 63 63   a3020000000014cc
0050  33 38 6c 66 68 62 66 62 35 64 32 61 32            38lfhbfb5d2a2

No.     Source                Protocol Length Info
      8 192.168.4.1           TCP      241    5233 → 49838 [PSH, ACK] Seq=188 Ack=79 Win=5762 Len=187

Frame 8: 241 bytes on wire (1928 bits), 241 bytes captured (1928 bits) on interface 0
    Interface id: 0 (\Device\NPF_{7914756B-14C8-4F93-8736-96A4610EEEB2})
        Interface name: \Device\NPF_{7914756B-14C8-4F93-8736-96A4610EEEB2}
        Interface description: Wi-Fi
    Encapsulation type: Ethernet (1)
    Arrival Time: Jan 21, 2020 00:34:41.419701000 CET
    [Time shift for this packet: 0.000000000 seconds]
    Epoch Time: 1579563281.419701000 seconds
    [Time delta from previous captured frame: 0.032274000 seconds]
    [Time delta from previous displayed frame: 0.032274000 seconds]
    [Time since reference or first frame: 1.158580000 seconds]
    Frame Number: 8
    Frame Length: 241 bytes (1928 bits)
    Capture Length: 241 bytes (1928 bits)
    [Frame is marked: False]
    [Frame is ignored: False]
    [Protocols in frame: eth:ethertype:ip:tcp:data]
    [Coloring Rule Name: TCP]
    [Coloring Rule String: tcp]
Ethernet II, Src: ee:fa:bc:c2:2e:c5 (ee:fa:bc:c2:2e:c5), Dst: KingjonD_6c:00:2b (00:13:ef:6c:00:2b)
    Destination: KingjonD_6c:00:2b (00:13:ef:6c:00:2b)
        Address: KingjonD_6c:00:2b (00:13:ef:6c:00:2b)
        .... ..0. .... .... .... .... = LG bit: Globally unique address (factory default)
        .... ...0 .... .... .... .... = IG bit: Individual address (unicast)
    Source: ee:fa:bc:c2:2e:c5 (ee:fa:bc:c2:2e:c5)
        Address: ee:fa:bc:c2:2e:c5 (ee:fa:bc:c2:2e:c5)
        .... ..1. .... .... .... .... = LG bit: Locally administered address (this is NOT the factory default)
        .... ...0 .... .... .... .... = IG bit: Individual address (unicast)
    Type: IPv4 (0x0800)
Internet Protocol Version 4, Src: 192.168.4.1, Dst: 192.168.4.2
    0100 .... = Version: 4
    .... 0101 = Header Length: 20 bytes (5)
    Differentiated Services Field: 0x00 (DSCP: CS0, ECN: Not-ECT)
        0000 00.. = Differentiated Services Codepoint: Default (0)
        .... ..00 = Explicit Congestion Notification: Not ECN-Capable Transport (0)
    Total Length: 227
    Identification: 0x0063 (99)
    Flags: 0x4000, Don't fragment
        0... .... .... .... = Reserved bit: Not set
        .1.. .... .... .... = Don't fragment: Set
        ..0. .... .... .... = More fragments: Not set
        ...0 0000 0000 0000 = Fragment offset: 0
    Time to live: 128
    Protocol: TCP (6)
    Header checksum: 0x705e [validation disabled]
    [Header checksum status: Unverified]
    Source: 192.168.4.1
    Destination: 192.168.4.2
Transmission Control Protocol, Src Port: 5233, Dst Port: 49838, Seq: 188, Ack: 79, Len: 187
    Source Port: 5233
    Destination Port: 49838
    [Stream index: 0]
    [TCP Segment Len: 187]
    Sequence number: 188    (relative sequence number)
    [Next sequence number: 375    (relative sequence number)]
    Acknowledgment number: 79    (relative ack number)
    0101 .... = Header Length: 20 bytes (5)
    Flags: 0x018 (PSH, ACK)
        000. .... .... = Reserved: Not set
        ...0 .... .... = Nonce: Not set
        .... 0... .... = Congestion Window Reduced (CWR): Not set
        .... .0.. .... = ECN-Echo: Not set
        .... ..0. .... = Urgent: Not set
        .... ...1 .... = Acknowledgment: Set
        .... .... 1... = Push: Set
        .... .... .0.. = Reset: Not set
        .... .... ..0. = Syn: Not set
        .... .... ...0 = Fin: Not set
        [TCP Flags: ·······AP···]
    Window size value: 5762
    [Calculated window size: 5762]
    [Window size scaling factor: -2 (no window scaling used)]
    Checksum: 0xa6df [unverified]
    [Checksum Status: Unverified]
    Urgent pointer: 0
    [SEQ/ACK analysis]
        [This is an ACK to the segment in frame: 7]
        [The RTT to ACK the segment was: 0.032274000 seconds]
        [iRTT: 0.022957000 seconds]
        [Bytes in flight: 187]
        [Bytes sent since last PSH flag: 187]
    [Timestamps]
        [Time since first frame in this TCP stream: 1.158580000 seconds]
        [Time since previous frame in this TCP stream: 0.032274000 seconds]
    TCP payload (187 bytes)
Data (187 bytes)
    Data: 633065656237633962616133303230303030303030303132...
    [Length: 187]

0000  00 13 ef 6c 00 2b ee fa bc c2 2e c5 08 00 45 00   ...l.+........E.
0010  00 e3 00 63 40 00 80 06 70 5e c0 a8 04 01 c0 a8   ...c@...p^......
0020  04 02 14 71 c2 ae 00 00 1b 4a 31 79 62 77 50 18   ...q.....J1ybwP.
0030  16 82 a6 df 00 00 63 30 65 65 62 37 63 39 62 61   ......c0eeb7c9ba
0040  61 33 30 32 30 30 30 30 30 30 30 30 31 32 63 63   a3020000000012cc
0050  33 38 6c 6e 74 32 30 30 31 30 30 5f 67 72 65 65   38lnt200100_gree
0060  6e 5f 65 61 72 74 68 2e 62 69 6e 32 30 30 32 30   n_earth.bin20020
0070  31 5f 67 72 65 65 6e 5f 65 61 72 74 68 2e 62 69   1_green_earth.bi
0080  6e 32 32 30 33 30 32 5f 73 70 69 6e 6e 69 6e 67   n220302_spinning
0090  5f 63 6f 69 6e 2e 62 69 6e 32 32 30 34 30 33 5f   _coin.bin220403_
00a0  73 70 69 6e 6e 69 6e 67 5f 63 6f 69 6e 2e 62 69   spinning_coin.bi
00b0  6e 32 33 30 35 30 34 5f 62 6f 75 6e 63 69 6e 67   n230504_bouncing
00c0  5f 66 72 61 70 68 2e 62 69 6e 32 33 30 36 30 35   _fraph.bin230605
00d0  5f 73 70 69 6e 6e 69 6e 67 5f 68 65 61 72 74 2e   _spinning_heart.
00e0  62 69 6e 30 32 48 45 31 31 62 66 62 35 64 32 61   bin02HE11bfb5d2a
00f0  32                                                2

No.     Source                Protocol Length Info
     10 192.168.4.2           TCP      93     49838 → 5233 [PSH, ACK] Seq=79 Ack=375 Win=63866 Len=39

Frame 10: 93 bytes on wire (744 bits), 93 bytes captured (744 bits) on interface 0
    Interface id: 0 (\Device\NPF_{7914756B-14C8-4F93-8736-96A4610EEEB2})
        Interface name: \Device\NPF_{7914756B-14C8-4F93-8736-96A4610EEEB2}
        Interface description: Wi-Fi
    Encapsulation type: Ethernet (1)
    Arrival Time: Jan 21, 2020 00:34:41.934375000 CET
    [Time shift for this packet: 0.000000000 seconds]
    Epoch Time: 1579563281.934375000 seconds
    [Time delta from previous captured frame: 0.469205000 seconds]
    [Time delta from previous displayed frame: 0.514674000 seconds]
    [Time since reference or first frame: 1.673254000 seconds]
    Frame Number: 10
    Frame Length: 93 bytes (744 bits)
    Capture Length: 93 bytes (744 bits)
    [Frame is marked: False]
    [Frame is ignored: False]
    [Protocols in frame: eth:ethertype:ip:tcp:data]
    [Coloring Rule Name: TCP]
    [Coloring Rule String: tcp]
Ethernet II, Src: KingjonD_6c:00:2b (00:13:ef:6c:00:2b), Dst: ee:fa:bc:c2:2e:c5 (ee:fa:bc:c2:2e:c5)
    Destination: ee:fa:bc:c2:2e:c5 (ee:fa:bc:c2:2e:c5)
        Address: ee:fa:bc:c2:2e:c5 (ee:fa:bc:c2:2e:c5)
        .... ..1. .... .... .... .... = LG bit: Locally administered address (this is NOT the factory default)
        .... ...0 .... .... .... .... = IG bit: Individual address (unicast)
    Source: KingjonD_6c:00:2b (00:13:ef:6c:00:2b)
        Address: KingjonD_6c:00:2b (00:13:ef:6c:00:2b)
        .... ..0. .... .... .... .... = LG bit: Globally unique address (factory default)
        .... ...0 .... .... .... .... = IG bit: Individual address (unicast)
    Type: IPv4 (0x0800)
Internet Protocol Version 4, Src: 192.168.4.2, Dst: 192.168.4.1
    0100 .... = Version: 4
    .... 0101 = Header Length: 20 bytes (5)
    Differentiated Services Field: 0x00 (DSCP: CS0, ECN: Not-ECT)
        0000 00.. = Differentiated Services Codepoint: Default (0)
        .... ..00 = Explicit Congestion Notification: Not ECN-Capable Transport (0)
    Total Length: 79
    Identification: 0xc5ee (50670)
    Flags: 0x4000, Don't fragment
        0... .... .... .... = Reserved bit: Not set
        .1.. .... .... .... = Don't fragment: Set
        ..0. .... .... .... = More fragments: Not set
        ...0 0000 0000 0000 = Fragment offset: 0
    Time to live: 128
    Protocol: TCP (6)
    Header checksum: 0xab66 [validation disabled]
    [Header checksum status: Unverified]
    Source: 192.168.4.2
    Destination: 192.168.4.1
Transmission Control Protocol, Src Port: 49838, Dst Port: 5233, Seq: 79, Ack: 375, Len: 39
    Source Port: 49838
    Destination Port: 5233
    [Stream index: 0]
    [TCP Segment Len: 39]
    Sequence number: 79    (relative sequence number)
    [Next sequence number: 118    (relative sequence number)]
    Acknowledgment number: 375    (relative ack number)
    0101 .... = Header Length: 20 bytes (5)
    Flags: 0x018 (PSH, ACK)
        000. .... .... = Reserved: Not set
        ...0 .... .... = Nonce: Not set
        .... 0... .... = Congestion Window Reduced (CWR): Not set
        .... .0.. .... = ECN-Echo: Not set
        .... ..0. .... = Urgent: Not set
        .... ...1 .... = Acknowledgment: Set
        .... .... 1... = Push: Set
        .... .... .0.. = Reset: Not set
        .... .... ..0. = Syn: Not set
        .... .... ...0 = Fin: Not set
        [TCP Flags: ·······AP···]
    Window size value: 63866
    [Calculated window size: 63866]
    [Window size scaling factor: -2 (no window scaling used)]
    Checksum: 0xc672 [unverified]
    [Checksum Status: Unverified]
    Urgent pointer: 0
    [SEQ/ACK analysis]
        [iRTT: 0.022957000 seconds]
        [Bytes in flight: 39]
        [Bytes sent since last PSH flag: 39]
    [Timestamps]
        [Time since first frame in this TCP stream: 1.673254000 seconds]
        [Time since previous frame in this TCP stream: 0.469205000 seconds]
    TCP payload (39 bytes)
Data (39 bytes)
    Data: 633065656237633962616133303230303030303030303134...
    [Length: 39]

0000  ee fa bc c2 2e c5 00 13 ef 6c 00 2b 08 00 45 00   .........l.+..E.
0010  00 4f c5 ee 40 00 80 06 ab 66 c0 a8 04 02 c0 a8   .O..@....f......
0020  04 01 c2 ae 14 71 31 79 62 77 00 00 1c 05 50 18   .....q1ybw....P.
0030  f9 7a c6 72 00 00 63 30 65 65 62 37 63 39 62 61   .z.r..c0eeb7c9ba
0040  61 33 30 32 30 30 30 30 30 30 30 30 31 34 63 63   a3020000000014cc
0050  33 38 6c 66 68 62 66 62 35 64 32 61 32            38lfhbfb5d2a2

No.     Source                Protocol Length Info
     11 192.168.4.1           TCP      241    5233 → 49838 [PSH, ACK] Seq=375 Ack=118 Win=5723 Len=187

Frame 11: 241 bytes on wire (1928 bits), 241 bytes captured (1928 bits) on interface 0
    Interface id: 0 (\Device\NPF_{7914756B-14C8-4F93-8736-96A4610EEEB2})
        Interface name: \Device\NPF_{7914756B-14C8-4F93-8736-96A4610EEEB2}
        Interface description: Wi-Fi
    Encapsulation type: Ethernet (1)
    Arrival Time: Jan 21, 2020 00:34:41.998822000 CET
    [Time shift for this packet: 0.000000000 seconds]
    Epoch Time: 1579563281.998822000 seconds
    [Time delta from previous captured frame: 0.064447000 seconds]
    [Time delta from previous displayed frame: 0.064447000 seconds]
    [Time since reference or first frame: 1.737701000 seconds]
    Frame Number: 11
    Frame Length: 241 bytes (1928 bits)
    Capture Length: 241 bytes (1928 bits)
    [Frame is marked: False]
    [Frame is ignored: False]
    [Protocols in frame: eth:ethertype:ip:tcp:data]
    [Coloring Rule Name: TCP]
    [Coloring Rule String: tcp]
Ethernet II, Src: ee:fa:bc:c2:2e:c5 (ee:fa:bc:c2:2e:c5), Dst: KingjonD_6c:00:2b (00:13:ef:6c:00:2b)
    Destination: KingjonD_6c:00:2b (00:13:ef:6c:00:2b)
        Address: KingjonD_6c:00:2b (00:13:ef:6c:00:2b)
        .... ..0. .... .... .... .... = LG bit: Globally unique address (factory default)
        .... ...0 .... .... .... .... = IG bit: Individual address (unicast)
    Source: ee:fa:bc:c2:2e:c5 (ee:fa:bc:c2:2e:c5)
        Address: ee:fa:bc:c2:2e:c5 (ee:fa:bc:c2:2e:c5)
        .... ..1. .... .... .... .... = LG bit: Locally administered address (this is NOT the factory default)
        .... ...0 .... .... .... .... = IG bit: Individual address (unicast)
    Type: IPv4 (0x0800)
Internet Protocol Version 4, Src: 192.168.4.1, Dst: 192.168.4.2
    0100 .... = Version: 4
    .... 0101 = Header Length: 20 bytes (5)
    Differentiated Services Field: 0x00 (DSCP: CS0, ECN: Not-ECT)
        0000 00.. = Differentiated Services Codepoint: Default (0)
        .... ..00 = Explicit Congestion Notification: Not ECN-Capable Transport (0)
    Total Length: 227
    Identification: 0x0064 (100)
    Flags: 0x4000, Don't fragment
        0... .... .... .... = Reserved bit: Not set
        .1.. .... .... .... = Don't fragment: Set
        ..0. .... .... .... = More fragments: Not set
        ...0 0000 0000 0000 = Fragment offset: 0
    Time to live: 128
    Protocol: TCP (6)
    Header checksum: 0x705d [validation disabled]
    [Header checksum status: Unverified]
    Source: 192.168.4.1
    Destination: 192.168.4.2
Transmission Control Protocol, Src Port: 5233, Dst Port: 49838, Seq: 375, Ack: 118, Len: 187
    Source Port: 5233
    Destination Port: 49838
    [Stream index: 0]
    [TCP Segment Len: 187]
    Sequence number: 375    (relative sequence number)
    [Next sequence number: 562    (relative sequence number)]
    Acknowledgment number: 118    (relative ack number)
    0101 .... = Header Length: 20 bytes (5)
    Flags: 0x018 (PSH, ACK)
        000. .... .... = Reserved: Not set
        ...0 .... .... = Nonce: Not set
        .... 0... .... = Congestion Window Reduced (CWR): Not set
        .... .0.. .... = ECN-Echo: Not set
        .... ..0. .... = Urgent: Not set
        .... ...1 .... = Acknowledgment: Set
        .... .... 1... = Push: Set
        .... .... .0.. = Reset: Not set
        .... .... ..0. = Syn: Not set
        .... .... ...0 = Fin: Not set
        [TCP Flags: ·······AP···]
    Window size value: 5723
    [Calculated window size: 5723]
    [Window size scaling factor: -2 (no window scaling used)]
    Checksum: 0xa624 [unverified]
    [Checksum Status: Unverified]
    Urgent pointer: 0
    [SEQ/ACK analysis]
        [This is an ACK to the segment in frame: 10]
        [The RTT to ACK the segment was: 0.064447000 seconds]
        [iRTT: 0.022957000 seconds]
        [Bytes in flight: 187]
        [Bytes sent since last PSH flag: 187]
    [Timestamps]
        [Time since first frame in this TCP stream: 1.737701000 seconds]
        [Time since previous frame in this TCP stream: 0.064447000 seconds]
    TCP payload (187 bytes)
Data (187 bytes)
    Data: 633065656237633962616133303230303030303030303132...
    [Length: 187]

0000  00 13 ef 6c 00 2b ee fa bc c2 2e c5 08 00 45 00   ...l.+........E.
0010  00 e3 00 64 40 00 80 06 70 5d c0 a8 04 01 c0 a8   ...d@...p]......
0020  04 02 14 71 c2 ae 00 00 1c 05 31 79 62 9e 50 18   ...q......1yb.P.
0030  16 5b a6 24 00 00 63 30 65 65 62 37 63 39 62 61   .[.$..c0eeb7c9ba
0040  61 33 30 32 30 30 30 30 30 30 30 30 31 32 63 63   a3020000000012cc
0050  33 38 6c 6e 74 32 30 30 31 30 30 5f 67 72 65 65   38lnt200100_gree
0060  6e 5f 65 61 72 74 68 2e 62 69 6e 32 30 30 32 30   n_earth.bin20020
0070  31 5f 67 72 65 65 6e 5f 65 61 72 74 68 2e 62 69   1_green_earth.bi
0080  6e 32 32 30 33 30 32 5f 73 70 69 6e 6e 69 6e 67   n220302_spinning
0090  5f 63 6f 69 6e 2e 62 69 6e 32 32 30 34 30 33 5f   _coin.bin220403_
00a0  73 70 69 6e 6e 69 6e 67 5f 63 6f 69 6e 2e 62 69   spinning_coin.bi
00b0  6e 32 33 30 35 30 34 5f 62 6f 75 6e 63 69 6e 67   n230504_bouncing
00c0  5f 66 72 61 70 68 2e 62 69 6e 32 33 30 36 30 35   _fraph.bin230605
00d0  5f 73 70 69 6e 6e 69 6e 67 5f 68 65 61 72 74 2e   _spinning_heart.
00e0  62 69 6e 30 32 48 45 31 31 62 66 62 35 64 32 61   bin02HE11bfb5d2a
00f0  32                                                2

No.     Source                Protocol Length Info
     13 192.168.4.2           TCP      93     49838 → 5233 [PSH, ACK] Seq=118 Ack=562 Win=63679 Len=39

Frame 13: 93 bytes on wire (744 bits), 93 bytes captured (744 bits) on interface 0
    Interface id: 0 (\Device\NPF_{7914756B-14C8-4F93-8736-96A4610EEEB2})
        Interface name: \Device\NPF_{7914756B-14C8-4F93-8736-96A4610EEEB2}
        Interface description: Wi-Fi
    Encapsulation type: Ethernet (1)
    Arrival Time: Jan 21, 2020 00:34:42.529123000 CET
    [Time shift for this packet: 0.000000000 seconds]
    Epoch Time: 1579563282.529123000 seconds
    [Time delta from previous captured frame: 0.487261000 seconds]
    [Time delta from previous displayed frame: 0.530301000 seconds]
    [Time since reference or first frame: 2.268002000 seconds]
    Frame Number: 13
    Frame Length: 93 bytes (744 bits)
    Capture Length: 93 bytes (744 bits)
    [Frame is marked: False]
    [Frame is ignored: False]
    [Protocols in frame: eth:ethertype:ip:tcp:data]
    [Coloring Rule Name: TCP]
    [Coloring Rule String: tcp]
Ethernet II, Src: KingjonD_6c:00:2b (00:13:ef:6c:00:2b), Dst: ee:fa:bc:c2:2e:c5 (ee:fa:bc:c2:2e:c5)
    Destination: ee:fa:bc:c2:2e:c5 (ee:fa:bc:c2:2e:c5)
        Address: ee:fa:bc:c2:2e:c5 (ee:fa:bc:c2:2e:c5)
        .... ..1. .... .... .... .... = LG bit: Locally administered address (this is NOT the factory default)
        .... ...0 .... .... .... .... = IG bit: Individual address (unicast)
    Source: KingjonD_6c:00:2b (00:13:ef:6c:00:2b)
        Address: KingjonD_6c:00:2b (00:13:ef:6c:00:2b)
        .... ..0. .... .... .... .... = LG bit: Globally unique address (factory default)
        .... ...0 .... .... .... .... = IG bit: Individual address (unicast)
    Type: IPv4 (0x0800)
Internet Protocol Version 4, Src: 192.168.4.2, Dst: 192.168.4.1
    0100 .... = Version: 4
    .... 0101 = Header Length: 20 bytes (5)
    Differentiated Services Field: 0x00 (DSCP: CS0, ECN: Not-ECT)
        0000 00.. = Differentiated Services Codepoint: Default (0)
        .... ..00 = Explicit Congestion Notification: Not ECN-Capable Transport (0)
    Total Length: 79
    Identification: 0xc5f0 (50672)
    Flags: 0x4000, Don't fragment
        0... .... .... .... = Reserved bit: Not set
        .1.. .... .... .... = Don't fragment: Set
        ..0. .... .... .... = More fragments: Not set
        ...0 0000 0000 0000 = Fragment offset: 0
    Time to live: 128
    Protocol: TCP (6)
    Header checksum: 0xab64 [validation disabled]
    [Header checksum status: Unverified]
    Source: 192.168.4.2
    Destination: 192.168.4.1
Transmission Control Protocol, Src Port: 49838, Dst Port: 5233, Seq: 118, Ack: 562, Len: 39
    Source Port: 49838
    Destination Port: 5233
    [Stream index: 0]
    [TCP Segment Len: 39]
    Sequence number: 118    (relative sequence number)
    [Next sequence number: 157    (relative sequence number)]
    Acknowledgment number: 562    (relative ack number)
    0101 .... = Header Length: 20 bytes (5)
    Flags: 0x018 (PSH, ACK)
        000. .... .... = Reserved: Not set
        ...0 .... .... = Nonce: Not set
        .... 0... .... = Congestion Window Reduced (CWR): Not set
        .... .0.. .... = ECN-Echo: Not set
        .... ..0. .... = Urgent: Not set
        .... ...1 .... = Acknowledgment: Set
        .... .... 1... = Push: Set
        .... .... .0.. = Reset: Not set
        .... .... ..0. = Syn: Not set
        .... .... ...0 = Fin: Not set
        [TCP Flags: ·······AP···]
    Window size value: 63679
    [Calculated window size: 63679]
    [Window size scaling factor: -2 (no window scaling used)]
    Checksum: 0xc64b [unverified]
    [Checksum Status: Unverified]
    Urgent pointer: 0
    [SEQ/ACK analysis]
        [iRTT: 0.022957000 seconds]
        [Bytes in flight: 39]
        [Bytes sent since last PSH flag: 39]
    [Timestamps]
        [Time since first frame in this TCP stream: 2.268002000 seconds]
        [Time since previous frame in this TCP stream: 0.487261000 seconds]
    TCP payload (39 bytes)
Data (39 bytes)
    Data: 633065656237633962616133303230303030303030303134...
    [Length: 39]

0000  ee fa bc c2 2e c5 00 13 ef 6c 00 2b 08 00 45 00   .........l.+..E.
0010  00 4f c5 f0 40 00 80 06 ab 64 c0 a8 04 02 c0 a8   .O..@....d......
0020  04 01 c2 ae 14 71 31 79 62 9e 00 00 1c c0 50 18   .....q1yb.....P.
0030  f8 bf c6 4b 00 00 63 30 65 65 62 37 63 39 62 61   ...K..c0eeb7c9ba
0040  61 33 30 32 30 30 30 30 30 30 30 30 31 34 63 63   a3020000000014cc
0050  33 38 6c 66 68 62 66 62 35 64 32 61 32            38lfhbfb5d2a2

No.     Source                Protocol Length Info
     14 192.168.4.1           TCP      241    5233 → 49838 [PSH, ACK] Seq=562 Ack=157 Win=5684 Len=187

Frame 14: 241 bytes on wire (1928 bits), 241 bytes captured (1928 bits) on interface 0
    Interface id: 0 (\Device\NPF_{7914756B-14C8-4F93-8736-96A4610EEEB2})
        Interface name: \Device\NPF_{7914756B-14C8-4F93-8736-96A4610EEEB2}
        Interface description: Wi-Fi
    Encapsulation type: Ethernet (1)
    Arrival Time: Jan 21, 2020 00:34:42.569605000 CET
    [Time shift for this packet: 0.000000000 seconds]
    Epoch Time: 1579563282.569605000 seconds
    [Time delta from previous captured frame: 0.040482000 seconds]
    [Time delta from previous displayed frame: 0.040482000 seconds]
    [Time since reference or first frame: 2.308484000 seconds]
    Frame Number: 14
    Frame Length: 241 bytes (1928 bits)
    Capture Length: 241 bytes (1928 bits)
    [Frame is marked: False]
    [Frame is ignored: False]
    [Protocols in frame: eth:ethertype:ip:tcp:data]
    [Coloring Rule Name: TCP]
    [Coloring Rule String: tcp]
Ethernet II, Src: ee:fa:bc:c2:2e:c5 (ee:fa:bc:c2:2e:c5), Dst: KingjonD_6c:00:2b (00:13:ef:6c:00:2b)
    Destination: KingjonD_6c:00:2b (00:13:ef:6c:00:2b)
        Address: KingjonD_6c:00:2b (00:13:ef:6c:00:2b)
        .... ..0. .... .... .... .... = LG bit: Globally unique address (factory default)
        .... ...0 .... .... .... .... = IG bit: Individual address (unicast)
    Source: ee:fa:bc:c2:2e:c5 (ee:fa:bc:c2:2e:c5)
        Address: ee:fa:bc:c2:2e:c5 (ee:fa:bc:c2:2e:c5)
        .... ..1. .... .... .... .... = LG bit: Locally administered address (this is NOT the factory default)
        .... ...0 .... .... .... .... = IG bit: Individual address (unicast)
    Type: IPv4 (0x0800)
Internet Protocol Version 4, Src: 192.168.4.1, Dst: 192.168.4.2
    0100 .... = Version: 4
    .... 0101 = Header Length: 20 bytes (5)
    Differentiated Services Field: 0x00 (DSCP: CS0, ECN: Not-ECT)
        0000 00.. = Differentiated Services Codepoint: Default (0)
        .... ..00 = Explicit Congestion Notification: Not ECN-Capable Transport (0)
    Total Length: 227
    Identification: 0x0065 (101)
    Flags: 0x4000, Don't fragment
        0... .... .... .... = Reserved bit: Not set
        .1.. .... .... .... = Don't fragment: Set
        ..0. .... .... .... = More fragments: Not set
        ...0 0000 0000 0000 = Fragment offset: 0
    Time to live: 128
    Protocol: TCP (6)
    Header checksum: 0x705c [validation disabled]
    [Header checksum status: Unverified]
    Source: 192.168.4.1
    Destination: 192.168.4.2
Transmission Control Protocol, Src Port: 5233, Dst Port: 49838, Seq: 562, Ack: 157, Len: 187
    Source Port: 5233
    Destination Port: 49838
    [Stream index: 0]
    [TCP Segment Len: 187]
    Sequence number: 562    (relative sequence number)
    [Next sequence number: 749    (relative sequence number)]
    Acknowledgment number: 157    (relative ack number)
    0101 .... = Header Length: 20 bytes (5)
    Flags: 0x018 (PSH, ACK)
        000. .... .... = Reserved: Not set
        ...0 .... .... = Nonce: Not set
        .... 0... .... = Congestion Window Reduced (CWR): Not set
        .... .0.. .... = ECN-Echo: Not set
        .... ..0. .... = Urgent: Not set
        .... ...1 .... = Acknowledgment: Set
        .... .... 1... = Push: Set
        .... .... .0.. = Reset: Not set
        .... .... ..0. = Syn: Not set
        .... .... ...0 = Fin: Not set
        [TCP Flags: ·······AP···]
    Window size value: 5684
    [Calculated window size: 5684]
    [Window size scaling factor: -2 (no window scaling used)]
    Checksum: 0xa569 [unverified]
    [Checksum Status: Unverified]
    Urgent pointer: 0
    [SEQ/ACK analysis]
        [This is an ACK to the segment in frame: 13]
        [The RTT to ACK the segment was: 0.040482000 seconds]
        [iRTT: 0.022957000 seconds]
        [Bytes in flight: 187]
        [Bytes sent since last PSH flag: 187]
    [Timestamps]
        [Time since first frame in this TCP stream: 2.308484000 seconds]
        [Time since previous frame in this TCP stream: 0.040482000 seconds]
    TCP payload (187 bytes)
Data (187 bytes)
    Data: 633065656237633962616133303230303030303030303132...
    [Length: 187]

0000  00 13 ef 6c 00 2b ee fa bc c2 2e c5 08 00 45 00   ...l.+........E.
0010  00 e3 00 65 40 00 80 06 70 5c c0 a8 04 01 c0 a8   ...e@...p\......
0020  04 02 14 71 c2 ae 00 00 1c c0 31 79 62 c5 50 18   ...q......1yb.P.
0030  16 34 a5 69 00 00 63 30 65 65 62 37 63 39 62 61   .4.i..c0eeb7c9ba
0040  61 33 30 32 30 30 30 30 30 30 30 30 31 32 63 63   a3020000000012cc
0050  33 38 6c 6e 74 32 30 30 31 30 30 5f 67 72 65 65   38lnt200100_gree
0060  6e 5f 65 61 72 74 68 2e 62 69 6e 32 30 30 32 30   n_earth.bin20020
0070  31 5f 67 72 65 65 6e 5f 65 61 72 74 68 2e 62 69   1_green_earth.bi
0080  6e 32 32 30 33 30 32 5f 73 70 69 6e 6e 69 6e 67   n220302_spinning
0090  5f 63 6f 69 6e 2e 62 69 6e 32 32 30 34 30 33 5f   _coin.bin220403_
00a0  73 70 69 6e 6e 69 6e 67 5f 63 6f 69 6e 2e 62 69   spinning_coin.bi
00b0  6e 32 33 30 35 30 34 5f 62 6f 75 6e 63 69 6e 67   n230504_bouncing
00c0  5f 66 72 61 70 68 2e 62 69 6e 32 33 30 36 30 35   _fraph.bin230605
00d0  5f 73 70 69 6e 6e 69 6e 67 5f 68 65 61 72 74 2e   _spinning_heart.
00e0  62 69 6e 30 32 48 45 31 31 62 66 62 35 64 32 61   bin02HE11bfb5d2a
